URL,Version,Status,OIDs,Name,Title,Descriptino,Uses,Used,Sources
http://hl7.org/fhir/ValueSet/additional-instruction-codes,4.0.1,draft,"2.16.840.1.113883.4.642.3.95",SNOMEDCTAdditionalDosageInstructions,SNOMED CT Additional Dosage Instructions,"This value set includes all SNOMED CT Additional Dosage Instructions.","StructureDefinition/BRPrescricaoMedicamento","SCT"
http://hl7.org/fhir/ValueSet/administration-method-codes,4.0.1,draft,"2.16.840.1.113883.4.642.3.97",SNOMEDCTAdministrationMethodCodes,SNOMED CT Administration Method Codes,"This value set includes some method codes from SNOMED CT - provided as an exemplar","StructureDefinition/BRPrescricaoMedicamento","SCT"
http://hl7.org/fhir/ValueSet/allergy-intolerance-type,4.0.1,draft,"2.16.840.1.113883.4.642.3.131",AllergyIntoleranceType,AllergyIntoleranceType,"Identification of the underlying physiological mechanism for a Reaction Risk.","StructureDefinition/BRAlergiaReacaoAdversa-1.0","hl7.fhir.r4.core"
http://hl7.org/fhir/ValueSet/allergyintolerance-clinical,4.0.1,draft,"2.16.840.1.113883.4.642.3.1372",AllergyIntoleranceClinicalStatusCodes,AllergyIntolerance Clinical Status Codes,"Preferred value set for AllergyIntolerance Clinical Status.","StructureDefinition/BRAlergiaReacaoAdversa-1.0","THO"
http://hl7.org/fhir/ValueSet/approach-site-codes,4.0.1,draft,"2.16.840.1.113883.4.642.3.346",SNOMEDCTAnatomicalStructureForAdministrationSiteCodes,SNOMED CT Anatomical Structure for Administration Site Codes,"This value set includes Anatomical Structure codes from SNOMED CT - provided as an exemplar.","StructureDefinition/BRPrescricaoMedicamento","SCT"
http://hl7.org/fhir/ValueSet/body-site,4.0.1,draft,"2.16.840.1.113883.4.642.3.141",SNOMEDCTBodyStructures,SNOMED CT Body Structures,"This value set includes all codes from [SNOMED CT](http://snomed.info/sct) where concept is-a 442083009 (Anatomical or acquired body site (body structure)).","StructureDefinition/BRProcedimentoRealizado-1.0,StructureDefinition/BRProblemaDiagnostico,StructureDefinition/BRObservacaoDescritiva-1.0,StructureDefinition/BRCID10Avaliado-1.0","SCT"
http://hl7.org/fhir/ValueSet/care-plan-activity-kind,4.0.1,draft,"2.16.840.1.113883.4.642.3.145",CarePlanActivityKind,Care Plan Activity Kind,"Resource types defined as part of FHIR that can be represented as in-line definitions of a care plan activity.","StructureDefinition/BRAtestado,StructureDefinition/BRPlanoCuidados-1.0","hl7.fhir.r4.core"
http://hl7.org/fhir/ValueSet/care-plan-activity-outcome,4.0.1,draft,"2.16.840.1.113883.4.642.3.149",CarePlanActivityOutcome,Care Plan Activity Outcome,"Example codes indicating the outcome of a care plan activity. Note that these are in no way complete and might not even be appropriate for some uses.","StructureDefinition/BRAtestado,StructureDefinition/BRPlanoCuidados-1.0","SCT"
http://hl7.org/fhir/ValueSet/care-plan-activity-status,4.0.1,draft,"2.16.840.1.113883.4.642.3.146",CarePlanActivityStatus,CarePlanActivityStatus,"Codes that reflect the current state of a care plan activity within its overall life cycle.","StructureDefinition/BRPlanoCuidados-1.0","hl7.fhir.r4.core"
http://hl7.org/fhir/ValueSet/care-plan-category,4.0.1,draft,"2.16.840.1.113883.4.642.3.148",CarePlanCategory,Care Plan Category,"Example codes indicating the category a care plan falls within.  Note that these are in no way complete and might not even be appropriate for some uses.","StructureDefinition/BRPlanoCuidados-1.0","SCT"
http://hl7.org/fhir/ValueSet/care-plan-intent,4.0.1,draft,"2.16.840.1.113883.4.642.3.150",CarePlanIntent,Care Plan Intent,"Codes indicating the degree of authority/intentionality associated with a care plan.","StructureDefinition/BRPlanoCuidados-1.0","hl7.fhir.r4.core"
http://hl7.org/fhir/ValueSet/clinical-findings,4.0.1,draft,"2.16.840.1.113883.4.642.3.232",SNOMEDCTClinicalFindings,SNOMED CT Clinical Findings,"This value set includes all the ""Clinical finding"" [SNOMED CT](http://snomed.info/sct) codes - concepts where concept is-a 404684003 (Clinical finding (finding)).","StructureDefinition/BRAtestado,StructureDefinition/BRPlanoCuidados-1.0","SCT"
http://hl7.org/fhir/ValueSet/composition-attestation-mode,4.0.1,draft,"2.16.840.1.113883.4.642.3.238",CompositionAttestationMode,CompositionAttestationMode,"The way in which a person authenticated a composition.","StructureDefinition/BRRegistroAtendimentoClinico,StructureDefinition/BRConjuntoMinimoDados-1.1,StructureDefinition/BRRegistroPrescricaoMedicamento","hl7.fhir.r4.core"
http://hl7.org/fhir/ValueSet/composition-status,4.0.1,draft,"2.16.840.1.113883.4.642.3.241",CompositionStatus,CompositionStatus,"The workflow/clinical status of the composition.","StructureDefinition/BRRegistroPrescricaoMedicamento","hl7.fhir.r4.core"
http://hl7.org/fhir/ValueSet/condition-code,4.0.1,draft,"2.16.840.1.113883.4.642.3.161",Condition/Problem/DiagnosisCodes,Condition/Problem/Diagnosis Codes,"Example value set for Condition/Problem/Diagnosis codes.","StructureDefinition/BRProcedimentoRealizado-1.0,StructureDefinition/BRPrescricaoMedicamento","SCT"
http://hl7.org/fhir/ValueSet/condition-severity,4.0.1,draft,"2.16.840.1.113883.4.642.3.168",Condition/DiagnosisSeverity,Condition/Diagnosis Severity,"Preferred value set for Condition/Diagnosis severity grading.","StructureDefinition/BRProblemaDiagnostico,StructureDefinition/BRCID10Avaliado-1.0","SCT"
http://hl7.org/fhir/ValueSet/condition-stage,4.0.1,draft,"2.16.840.1.113883.4.642.3.170",ConditionStage,Condition Stage,"Example value set for stages of cancer and other conditions.","StructureDefinition/BRProblemaDiagnostico,StructureDefinition/BRCID10Avaliado-1.0","SCT"
http://hl7.org/fhir/ValueSet/condition-stage-type,4.0.1,draft,"2.16.840.1.113883.4.642.3.171",ConditionStageType,Condition Stage Type,"Example value set for the type of stages of cancer and other conditions","StructureDefinition/BRProblemaDiagnostico,StructureDefinition/BRCID10Avaliado-1.0","SCT"
http://hl7.org/fhir/ValueSet/condition-ver-status,4.0.1,draft,"2.16.840.1.113883.4.642.3.166",ConditionVerificationStatus,ConditionVerificationStatus,"The verification status to support or decline the clinical status of the condition or diagnosis.","StructureDefinition/BRProblemaDiagnostico,StructureDefinition/BRCID10Avaliado-1.0","THO"
http://hl7.org/fhir/ValueSet/data-absent-reason,4.0.1,active,"2.16.840.1.113883.4.642.3.5",DataAbsentReason,DataAbsentReason,"Used to specify why the normally expected content of the data element is missing.","StructureDefinition/BRMedidaObservada,StructureDefinition/BRObservacaoDescritiva-1.0","THO"
http://hl7.org/fhir/ValueSet/days-of-week,4.0.1,active,"2.16.840.1.113883.4.642.3.512",DaysOfWeek,DaysOfWeek,"The days of the week.","StructureDefinition/BRPrescricaoMedicamento,StructureDefinition/BRAtestado,StructureDefinition/BRMedidaObservada,StructureDefinition/BRLocalAtendimento-1.0","hl7.fhir.r4.core"
http://hl7.org/fhir/ValueSet/device-action,4.0.1,draft,"2.16.840.1.113883.4.642.3.425",ProcedureDeviceActionCodes,Procedure Device Action Codes,"Example codes indicating the change that happened to the device during the procedure.  Note that these are in no way complete and might not even be appropriate for some uses.","StructureDefinition/BRProcedimentoRealizado-1.0","SCT"
http://hl7.org/fhir/ValueSet/device-kind,4.0.1,draft,"2.16.840.1.113883.4.642.3.208",FHIRDeviceTypes,FHIR Device Types,"Codes used to identify medical devices. Includes concepts from SNOMED CT (http://www.snomed.org/) where concept is-a 49062001 (Device)  and is provided as a suggestive example.","StructureDefinition/BRProcedimentoRealizado-1.0","SCT"
http://hl7.org/fhir/ValueSet/diagnosis-role,4.0.1,draft,"2.16.840.1.113883.4.642.3.49",DiagnosisRole,DiagnosisRole,"This value set defines a set of codes that can be used to express the role of a diagnosis on the Encounter or EpisodeOfCare record.","StructureDefinition/BRContatoAssistencial-1.0","THO"
http://hl7.org/fhir/ValueSet/doc-section-codes,4.0.1,draft,"2.16.840.1.113883.4.642.3.237",DocumentSectionCodes,Document Section Codes,"Document section codes (LOINC codes used in CCDA sections).","StructureDefinition/BRRegistroAtendimentoClinico,StructureDefinition/BRConjuntoMinimoDados-1.1,StructureDefinition/BRRegistroPrescricaoMedicamento","LOINC"
http://hl7.org/fhir/ValueSet/document-classcodes,4.0.1,active,"2.16.840.1.113883.3.88.12.80.46",DocumentClassValueSet,Document Class Value Set,"This is the code specifying the high-level kind of document (e.g. Prescription, Discharge Summary, Report, etc.). Note: Class code for documents comes from LOINC, and is based upon one of the following:The type of service described by the document. It is described at a very high level in Section 7.3 of the LOINC Manual. The type study performed. It was determined by identifying modalities for study reports. The section of the chart where the document is placed. It was determined from the SETs created for Claims Attachment requests.","StructureDefinition/BRRegistroPrescricaoMedicamento","LOINC"
http://hl7.org/fhir/ValueSet/document-relationship-type,4.0.1,draft,"2.16.840.1.113883.4.642.3.244",DocumentRelationshipType,DocumentRelationshipType,"The type of relationship between documents.","StructureDefinition/BRRegistroAtendimentoClinico,StructureDefinition/BRConjuntoMinimoDados-1.1,StructureDefinition/BRRegistroPrescricaoMedicamento","hl7.fhir.r4.core"
http://hl7.org/fhir/ValueSet/encounter-diet,4.0.1,draft,"2.16.840.1.113883.4.642.3.255",Diet,Diet,"This value set defines a set of codes that can be used to indicate dietary preferences or restrictions a patient may have.","StructureDefinition/BRContatoAssistencial-1.0","THO"
http://hl7.org/fhir/ValueSet/encounter-location-status,4.0.1,draft,"2.16.840.1.113883.4.642.3.262",EncounterLocationStatus,EncounterLocationStatus,"The status of the location.","StructureDefinition/BRContatoAssistencial-1.0","hl7.fhir.r4.core"
http://hl7.org/fhir/ValueSet/encounter-reason,4.0.1,draft,"2.16.840.1.113883.4.642.3.261",EncounterReasonCodes,Encounter Reason Codes,"This examples value set defines the set of codes that can be used to indicate reasons for an encounter.","StructureDefinition/BRContatoAssistencial-1.0","SCT"
http://hl7.org/fhir/ValueSet/encounter-special-arrangements,4.0.1,draft,"2.16.840.1.113883.4.642.3.253",SpecialArrangements,Special arrangements,"This value set defines a set of codes that can be used to indicate the kinds of special arrangements in place for a patients visit.","StructureDefinition/BRContatoAssistencial-1.0","THO"
http://hl7.org/fhir/ValueSet/encounter-special-courtesy,4.0.1,draft,"2.16.840.1.113883.4.642.3.252",SpecialCourtesy,Special courtesy,"This value set defines a set of codes that can be used to indicate special courtesies provided to the patient.","StructureDefinition/BRContatoAssistencial-1.0","THO (V3)"
http://hl7.org/fhir/ValueSet/encounter-status,4.0.1,draft,"2.16.840.1.113883.4.642.3.246",EncounterStatus,EncounterStatus,"Current state of the encounter.","StructureDefinition/BRContatoAssistencial-1.0","hl7.fhir.r4.core"
http://hl7.org/fhir/ValueSet/encounter-type,4.0.1,draft,"2.16.840.1.113883.4.642.3.248",EncounterType,Encounter type,"This example value set defines a set of codes that can be used to indicate the type of encounter: a specific code indicating type of service provided.","StructureDefinition/BRContatoAssistencial-1.0","THO"
http://hl7.org/fhir/ValueSet/event-timing,4.0.1,active,"2.16.840.1.113883.4.642.3.75",EventTiming,EventTiming,"Real world event relating to the schedule.","StructureDefinition/BRPrescricaoMedicamento,StructureDefinition/BRAtestado,StructureDefinition/BRMedidaObservada","THO (V3),hl7.fhir.r4.core"
http://hl7.org/fhir/ValueSet/identifier-type,4.0.1,active,"2.16.840.1.113883.4.642.3.45",Identifier Type Codes,IdentifierType,"A coded type for an identifier that can be used to determine which identifier to use for a specific purpose.","StructureDefinition/BRRegistroAtendimentoClinico,StructureDefinition/BRProcedimentoRealizado-1.0,StructureDefinition/BRConjuntoMinimoDados-1.1,StructureDefinition/BRPrescricaoMedicamento,StructureDefinition/BRAtestado,StructureDefinition/BRPlanoCuidados-1.0,StructureDefinition/BRAlergiaReacaoAdversa-1.0,StructureDefinition/BRMedidaObservada,StructureDefinition/BRProblemaDiagnostico,StructureDefinition/BRContatoAssistencial-1.0,StructureDefinition/BRObservacaoDescritiva-1.0,StructureDefinition/BRCID10Avaliado-1.0","THO (V2)"
http://hl7.org/fhir/ValueSet/identifier-use,4.0.1,active,"2.16.840.1.113883.4.642.3.57",IdentifierUse,IdentifierUse,"Identifies the purpose for this identifier, if known .","StructureDefinition/BRRegistroAtendimentoClinico,StructureDefinition/BRProcedimentoRealizado-1.0,StructureDefinition/BRConjuntoMinimoDados-1.1,StructureDefinition/BRPrescricaoMedicamento,StructureDefinition/BRAtestado,StructureDefinition/BRPlanoCuidados-1.0,StructureDefinition/BRAlergiaReacaoAdversa-1.0,StructureDefinition/BRMedidaObservada,StructureDefinition/BRProblemaDiagnostico,StructureDefinition/BRContatoAssistencial-1.0,StructureDefinition/BRObservacaoDescritiva-1.0,StructureDefinition/BRCID10Avaliado-1.0","hl7.fhir.r4.core"
http://hl7.org/fhir/ValueSet/languages,4.0.1,draft,"2.16.840.1.113883.4.642.3.20",CommonLanguages,Common Languages,"This value set includes common codes from BCP-47 (http://tools.ietf.org/html/bcp47)","StructureDefinition/BRRegistroAtendimentoClinico,StructureDefinition/BRProcedimentoRealizado-1.0,StructureDefinition/BRConjuntoMinimoDados-1.1,StructureDefinition/BRAtestado,StructureDefinition/BRMedicamento,StructureDefinition/BRMedidaObservada,StructureDefinition/BRCID10Avaliado-1.0,StructureDefinition/BRPrescricaoMedicamento,StructureDefinition/BRPlanoCuidados-1.0,StructureDefinition/BRAlergiaReacaoAdversa-1.0,StructureDefinition/BRRegistroPrescricaoMedicamento,StructureDefinition/BRLocalAtendimento-1.0,StructureDefinition/BRProblemaDiagnostico,StructureDefinition/BRContatoAssistencial-1.0,StructureDefinition/BRObservacaoDescritiva-1.0","hl7.terminology.r4"
http://hl7.org/fhir/ValueSet/list-empty-reason,4.0.1,draft,"2.16.840.1.113883.4.642.3.322",ListEmptyReasons,List Empty Reasons,"General reasons for a list to be empty. Reasons are either related to a summary list (i.e. problem or medication list) or to a workflow related list (i.e. consultation list).","StructureDefinition/BRRegistroAtendimentoClinico,StructureDefinition/BRConjuntoMinimoDados-1.1,StructureDefinition/BRRegistroPrescricaoMedicamento","THO"
http://hl7.org/fhir/ValueSet/list-mode,4.0.1,draft,"2.16.840.1.113883.4.642.3.318",ListMode,ListMode,"The processing mode that applies to this list.","StructureDefinition/BRRegistroAtendimentoClinico,StructureDefinition/BRConjuntoMinimoDados-1.1,StructureDefinition/BRRegistroPrescricaoMedicamento","hl7.fhir.r4.core"
http://hl7.org/fhir/ValueSet/list-order,4.0.1,draft,"2.16.840.1.113883.4.642.3.324",ListOrderCodes,List Order Codes,"Base values for the order of the items in a list resource.","StructureDefinition/BRRegistroAtendimentoClinico,StructureDefinition/BRConjuntoMinimoDados-1.1,StructureDefinition/BRRegistroPrescricaoMedicamento","THO"
http://hl7.org/fhir/ValueSet/location-mode,4.0.1,draft,"2.16.840.1.113883.4.642.3.330",LocationMode,LocationMode,"Indicates whether a resource instance represents a specific location or a class of locations.","StructureDefinition/BRLocalAtendimento-1.0","hl7.fhir.r4.core"
http://hl7.org/fhir/ValueSet/location-physical-type,4.0.1,draft,"2.16.840.1.113883.4.642.3.328",LocationType,Location type,"This example value set defines a set of codes that can be used to indicate the physical form of the Location.","StructureDefinition/BRLocalAtendimento-1.0,StructureDefinition/BRContatoAssistencial-1.0","THO"
http://hl7.org/fhir/ValueSet/location-status,4.0.1,draft,"2.16.840.1.113883.4.642.3.332",LocationStatus,LocationStatus,"Indicates whether the location is still in use.","StructureDefinition/BRLocalAtendimento-1.0","hl7.fhir.r4.core"
http://hl7.org/fhir/ValueSet/manifestation-or-symptom,4.0.1,draft,"2.16.840.1.113883.4.642.3.169",ManifestationAndSymptomCodes,Manifestation and Symptom Codes,"Example value set for Manifestation and Symptom codes.","StructureDefinition/BRProblemaDiagnostico,StructureDefinition/BRCID10Avaliado-1.0","SCT"
http://hl7.org/fhir/ValueSet/medication-codes,4.0.1,draft,"2.16.840.1.113883.4.642.3.375",SNOMEDCTMedicationCodes,SNOMED CT Medication Codes,"This value set includes all drug or medicament substance codes and all pharmaceutical/biologic products from SNOMED CT - provided as an exemplar value set.","StructureDefinition/BRAtestado,StructureDefinition/BRPlanoCuidados-1.0","SCT"
http://hl7.org/fhir/ValueSet/medicationrequest-category,4.0.1,draft,"2.16.840.1.113883.4.642.3.1322",medicationRequest Category Codes,Medication request  category  codes,"MedicationRequest Category Codes","StructureDefinition/BRPrescricaoMedicamento","THO"
http://hl7.org/fhir/ValueSet/medicationrequest-course-of-therapy,4.0.1,draft,"2.16.840.1.113883.4.642.3.1326",medicationRequest Course of Therapy Codes,Medication request  course of  therapy  codes,"MedicationRequest Course of Therapy Codes","StructureDefinition/BRPrescricaoMedicamento","THO"
http://hl7.org/fhir/ValueSet/medicationrequest-intent,4.0.1,draft,"2.16.840.1.113883.4.642.3.1321",medicationRequest Intent,Medication request  intent,"MedicationRequest Intent Codes","StructureDefinition/BRPrescricaoMedicamento","hl7.fhir.r4.core"
http://hl7.org/fhir/ValueSet/medicationrequest-status,4.0.1,draft,"2.16.840.1.113883.4.642.3.1320",medicationrequest Status,Medicationrequest  status,"MedicationRequest Status Codes","StructureDefinition/BRPrescricaoMedicamento","hl7.fhir.r4.core"
http://hl7.org/fhir/ValueSet/medicationrequest-status-reason,4.0.1,draft,"2.16.840.1.113883.4.642.3.1324",medicationRequest Status Reason Codes,Medication request  status  reason  codes,"MedicationRequest Status Reason Codes","StructureDefinition/BRPrescricaoMedicamento","THO"
http://hl7.org/fhir/ValueSet/observation-category,4.0.1,draft,"2.16.840.1.113883.4.642.3.403",ObservationCategoryCodes,Observation Category Codes,"Observation Category codes.","StructureDefinition/BRMedidaObservada,StructureDefinition/BRObservacaoDescritiva-1.0","THO"
http://hl7.org/fhir/ValueSet/observation-codes,4.0.1,draft,"2.16.840.1.113883.4.642.3.396",LOINCCodes,LOINC Codes,"This value set includes all LOINC codes","StructureDefinition/BRMedidaObservada,StructureDefinition/BRObservacaoDescritiva-1.0","LOINC"
http://hl7.org/fhir/ValueSet/observation-interpretation,4.0.1,active,"2.16.840.1.113883.4.642.3.399",ObservationInterpretationCodes,Observation Interpretation Codes,"A categorical assessment, providing a rough qualitative interpretation of the observation value,    such as “normal”/ “abnormal”,”low” / “high”, “better” / “worse”, “susceptible” / “resistant”, “expected”/ “not expected”.    The value set is intended to be for ANY use where coded representation of an interpretation is needed.             Notes:          This is being communicated in v2.x in OBX-8 (Observation Interpretation), in v3 in ObservationInterpretation (CWE) in R1 (Representative Realm) and in FHIR in    Observation.interpretation. Historically these values come from the laboratory domain, and these codes are extensively    used. The value set binding is extensible, so codes outside the value set that are needed for interpretation concepts    (i.e. particular meanings) that are not included in the value set can be used, and these new codes may also be added to    the value set and published in a future version.","StructureDefinition/BRMedidaObservada,StructureDefinition/BRObservacaoDescritiva-1.0","THO (V3)"
http://hl7.org/fhir/ValueSet/observation-methods,4.0.1,draft,"2.16.840.1.113883.4.642.3.395",ObservationMethods,Observation Methods,"Observation Method codes from [SNOMED CT](http://snomed.info/sct) where concept is-a 272394005 (Technique (qualifier value)) or is-a 129264002 (Action (qualifier value)) or is-a 386053000 (Evaluation procedure(procedure))","StructureDefinition/BRObservacaoDescritiva-1.0","SCT"
http://hl7.org/fhir/ValueSet/performer-role,4.0.1,draft,"2.16.840.1.113883.4.642.3.433",ProcedurePerformerRoleCodes,Procedure Performer Role Codes,"This example value set defines the set of codes that can be used to indicate a role of a procedure performer.","StructureDefinition/BRPrescricaoMedicamento","SCT"
http://hl7.org/fhir/ValueSet/procedure-category,4.0.1,draft,"2.16.840.1.113883.4.642.3.430",ProcedureCategoryCodes(SNOMEDCT),Procedure Category Codes (SNOMED CT),"Procedure Category code: A selection of relevant SNOMED CT codes.","StructureDefinition/BRProcedimentoRealizado-1.0","SCT"
http://hl7.org/fhir/ValueSet/procedure-code,4.0.1,draft,"2.16.840.1.113883.4.642.3.427",ProcedureCodes(SNOMEDCT),Procedure Codes (SNOMED CT),"Procedure Code: All SNOMED CT procedure codes.","StructureDefinition/BRAtestado,StructureDefinition/BRPlanoCuidados-1.0","SCT"
http://hl7.org/fhir/ValueSet/procedure-followup,4.0.1,draft,"2.16.840.1.113883.4.642.3.429",ProcedureFollowUpCodes(SNOMEDCT),Procedure Follow up Codes (SNOMED CT),"Procedure follow up codes: A selection of SNOMED CT codes relevant to procedure follow up.","StructureDefinition/BRProcedimentoRealizado-1.0","SCT"
http://hl7.org/fhir/ValueSet/procedure-not-performed-reason,4.0.1,active,"2.16.840.1.113883.4.642.3.431",ProcedureNotPerformedReason(SNOMED-CT),Procedure Not Performed Reason (SNOMED-CT),"Situation codes describing the reason that a procedure, which might otherwise be expected, was not performed, or a procedure that was started and was not completed. Consists of SNOMED CT codes, children of procedure contraindicated (183932001), procedure discontinued (416406003), procedure not done (416237000), procedure not indicated (428119001), procedure not offered (416064006), procedure not wanted (416432009), procedure refused (183944003), and procedure stopped (394908001).","StructureDefinition/BRProcedimentoRealizado-1.0","SCT"
http://hl7.org/fhir/ValueSet/procedure-outcome,4.0.1,draft,"2.16.840.1.113883.4.642.3.428",ProcedureOutcomeCodes(SNOMEDCT),Procedure Outcome Codes (SNOMED CT),"Procedure Outcome code: A selection of relevant SNOMED CT codes.","StructureDefinition/BRProcedimentoRealizado-1.0","SCT"
http://hl7.org/fhir/ValueSet/procedure-reason,4.0.1,draft,"2.16.840.1.113883.4.642.3.432",ProcedureReasonCodes,Procedure Reason Codes,"This example value set defines the set of codes that can be used to indicate a reason for a procedure.","StructureDefinition/BRProcedimentoRealizado-1.0","SCT"
http://hl7.org/fhir/ValueSet/quantity-comparator,4.0.1,active,"2.16.840.1.113883.4.642.3.59",QuantityComparator,QuantityComparator,"How the Quantity should be understood and represented.","StructureDefinition/BRPrescricaoMedicamento","hl7.fhir.r4.core"
http://hl7.org/fhir/ValueSet/reaction-event-severity,4.0.1,draft,"2.16.840.1.113883.4.642.3.135",AllergyIntoleranceSeverity,AllergyIntoleranceSeverity,"Clinical assessment of the severity of a reaction event as a whole, potentially considering multiple different manifestations.","StructureDefinition/BRAlergiaReacaoAdversa-1.0","hl7.fhir.r4.core"
http://hl7.org/fhir/ValueSet/referencerange-appliesto,4.0.1,draft,"2.16.840.1.113883.4.642.3.407",ObservationReferenceRangeAppliesToCodes,Observation Reference Range Applies To Codes,"This value set defines a set of codes that can be used to indicate the particular target population the reference range applies to.","StructureDefinition/BRMedidaObservada,StructureDefinition/BRObservacaoDescritiva-1.0","SCT"
http://hl7.org/fhir/ValueSet/referencerange-meaning,4.0.1,draft,"2.16.840.1.113883.4.642.3.397",ObservationReferenceRangeMeaningCodes,Observation Reference Range Meaning Codes,"This value set defines a set of codes that can be used to indicate the meaning/use of a reference range for a particular target population.","StructureDefinition/BRMedidaObservada,StructureDefinition/BRObservacaoDescritiva-1.0","THO"
http://hl7.org/fhir/ValueSet/request-priority,4.0.1,draft,"2.16.840.1.113883.4.642.3.115",RequestPriority,Request priority,"The clinical priority of a diagnostic order.","StructureDefinition/BRPrescricaoMedicamento","hl7.fhir.r4.core"
http://hl7.org/fhir/ValueSet/resource-types,5.0.0,active,"2.16.840.1.113883.4.642.3.27",ResourceType,Resource Types,"Concrete FHIR Resource Types","StructureDefinition/BRRegistroAtendimentoClinico,StructureDefinition/BRProcedimentoRealizado-1.0,StructureDefinition/BRConjuntoMinimoDados-1.1,StructureDefinition/BRAtestado,StructureDefinition/BRMedidaObservada,StructureDefinition/BRCID10Avaliado-1.0,StructureDefinition/BRPrescricaoMedicamento,StructureDefinition/BRPlanoCuidados-1.0,StructureDefinition/BRAlergiaReacaoAdversa-1.0,StructureDefinition/BRRegistroPrescricaoMedicamento,StructureDefinition/BRProblemaDiagnostico,StructureDefinition/BRContatoAssistencial-1.0,StructureDefinition/BRObservacaoDescritiva-1.0","FHIR"
http://hl7.org/fhir/ValueSet/route-codes,4.0.1,draft,"2.16.840.1.113883.4.642.3.98",SNOMEDCTRouteCodes,SNOMED CT Route Codes,"This value set includes all Route codes from SNOMED CT - provided as an exemplar.","StructureDefinition/BRAlergiaReacaoAdversa-1.0","SCT"
http://hl7.org/fhir/ValueSet/service-type,4.0.1,draft,"2.16.840.1.113883.4.642.3.518",ServiceType,Service type,"This value set defines an example set of codes of service-types.","StructureDefinition/BRContatoAssistencial-1.0","THO"
http://hl7.org/fhir/ValueSet/substance-code,4.0.1,draft,"2.16.840.1.113883.4.642.3.473",SubstanceCode,Substance Code,"This value set contains concept codes for specific substances. It includes codes from [SNOMED](http://snomed.info/sct) where concept is-a 105590001 (Substance (substance)) and where concept is-a 373873005 (Pharmaceutical / biologic product (product))","StructureDefinition/BRAlergiaReacaoAdversa-1.0","SCT"
